{
  "schemaVersion": 1,
  "id": "2b8e7f90-a123-4bcd-8678-0a1b2c3d4e5f",
  "creationId": "0c7f6d8e-9012-4abc-8567-9a0b1c2d3e4f",
  "parentRevisionId": null,
  "changeInstruction": "Legacy fixture without a recorded platform.",
  "promptSha256": "4fcab23ba9ca6ad89a99b5d0e4497808a8cb322f8b91acfbf22cb2d0cc4f576e",
  "createdAt": "2026-08-02T12:02:05.000Z"
}
